,Article Class,Article Titles,List of Article Author Names
0,Reviews,ARadiologist’sGuidetothe2021WHOCentralNervousSystemTumorClassification:PartI—KeyConceptsandtheSpectrumofDiffuseGliomasnr,"Derek R. Johnson, Caterina Giannini, Rachael A. Vaubel, Jonathan M. Morris, Laurence J. Eckel, Timothy J. Kaufmann, Julie B. Guerin"
1,Research in Practice,MachineLearningforHepatocellularCarcinomaSegmentationatMRI:RadiologyInTraininggimrai,"Alex G. Raman, Craig Jones, Clifford R. Weiss"
2,Research in Practice,CTofOvarianCancerforPrimaryTreatmentPlanning:WhattheSurgeonNeedstoKnow—RadiologyInTrainingguctob,"Maria Clara Fernandes, Ines Nikolovski, Kara Long Roche, Yulia Lakhman"
3,Images in Radiology,TransperinealAnalThree-dimensionalUS,"Yanting Wen, Xiaoqian Tong"
4,Images in Radiology,MRIntracranialVenographyat7T,"Dhairya A. Lakhani, Erik H. Middlebrooks"
5,Images in Radiology,StandingWaveArtifactatCTAngiography,"Matthew T. Stib, Sandeep S. Hedgire"
6,Images in Radiology,CTofHumanInfectionwithAvian-OriginInfluenzaA(H10N3)Virus,"Qiuzhen Xu, Fengli Jiang"
7,Images in Radiology,CinematicRenderingoftheVariantPortalVenousAnatomy,"Wendi Kang, Hongjiang Fu"
8,Images in Radiology,BreastInflammatoryChangeIsTransientFollowingCOVID-19Vaccination,"Eric Kim, Beatriu Reig"
9,Breast Imaging,"MammographicBreastDensity,BenignBreastDisease,andSubsequentBreastCancerRiskin3.9MillionKoreanWomenbr","Soyeoun Kim, Thi Xuan Mai Tran, Huiyeon Song, Seungho Ryu, Yoosoo Chang, Boyoung Park"
10,Cardiac Imaging,RelationofMRIAorticWallAreaandPlaquetoIncidentCardiovascularEvents:TheFraminghamHeartStudycamr,"Ulf Neisius, Philimon N. Gona, Noriko Oyama-Manabe, Michael L. Chuang, Christopher J. O’Donnell, Warren J. Manning, Connie W. Tsao"
11,Editorial,MRIoftheAorticWalltoAssessCardiovascularRiskandPrognosiscamr,Ronald M. Peshock
12,Cardiac Imaging,MyocardialInjuryPatternatMRIinCOVID-19Vaccine–AssociatedMyocarditiscamr,"Matteo Fronza, Paaladinesh Thavendiranathan, Victor Chan, Gauri Rani Karur, Jacob A. Udell, Rachel M. Wald, Rachel Hong, Kate Hanneman"
13,Editorial,PostvaccineMyocarditis:ARiskWorththeReward?camr,"Betty Raman, Stefan Neubauer"
14,Evidence-based Practice,DiagnosticAccuracyofCardiacMRIversusFDGPETforCardiacSarcoidosis:ASystematicReviewandMeta-Analysiscamr,"Matthew Aitken, Michael Vinchill Chan, Camila Urzua Fresno, Ashley Farrell, Nayaar Islam, Matthew D. F. McInnes, Mark Iwanochko, Meyer Balter, Yasbanoo Moayedi, Paaladinesh Thavendiranathan, Ur Metser, Patrick Veit-Haibach, Kate Hanneman"
15,Genitourinary Imaging,ComparisonofFourDual-EnergyCTScannerTechnologiesforDeterminingRenalStoneComposition:APhantomApproachguct,"Ali Pourvaziri, Anushri Parakh, Jinjin Cao, Joseph Locascio, Brian Eisner, Dushyant Sahani, Avinash Kambadakone"
16,Editorial,ComparisonofFourDual-EnergyCTScannerTechnologiesforDeterminingRenalStoneCompositionUsingaPhantomApproachguct,"Helmut Ringl, Paul Apfaltrer"
17,Genitourinary Imaging,MultiparametricMRIEvaluationofVI-RADSforBladderTumorsLocatedattheUreteralOrificegu,"Qian Cai, Jian Ling, Lingmin Kong, Yiping Huang, Yingyu Lin, Zhihua Wen, Meiqin Li, Yan Guo, Huanjun Wang"
18,Molecular Imaging,Impactof18F-DCFPyLPETonStagingandTreatmentofUnfavorableIntermediateorHigh-RiskProstateCancermioi,"Adriano Basso Dias, Antonio Finelli, Glenn Bauman, Patrick Veit-Haibach, Alejandro Berlin, Claudia Ortega, Lisa Avery, Ur Metser"
19,Editorial,Prostate-specificMembraneAntigenPET:StandardImaginginProstateCancermioi,Hossein Jadvar
20,Musculoskeletal Imaging,MRI-basedTextureAnalysisofInfrapatellarFatPadtoPredictKneeOsteoarthritisIncidencemkmr,"Jia Li, Shuai Fu, Ze Gong, Zhaohua Zhu, Dong Zeng, Peihua Cao, Ting Lin, Tianyu Chen, Xiaoshuai Wang, Richard Lartey, C. Kent Kwoh, Ali Guermazi, Frank W. Roemer, David J. Hunter, Jianhua Ma, Changhai Ding"
21,Editorial,FromMorphologytoBiomarker:QuantitativeTextureAnalysisoftheInfrapatellarFatPadReliablyPredictsKneeOsteoarthritismkmr,Michael A. Fischer
22,Neuroradiology,Resting-StateFunctionalMRIofHealthyAdults:TemporalDynamicBrainCoactivationPatternsnrmr,"Tiantian Liu, Li Wang, Dingjie Suo, Jian Zhang, Kexin Wang, Jue Wang, Duanduan Chen, Tianyi Yan"
23,Editorial,Resting-StateFunctionalMRIChangesinNormalHumanAgingnrmr,Andrei I. Holodny
24,Neuroradiology,ChoroidPlexusVolumeandPermeabilityatBrainMRIwithintheAlzheimerDiseaseClinicalSpectrumnrmr,"Jong Duck Choi, Yeonsil Moon, Hee-Jin Kim, Younghee Yim, Subin Lee, Won-Jin Moon"
25,Editorial,TheBlood–CerebrospinalFluidBarrierMayPlayaRoleinAlzheimerDiseasePathogenesisnrmr,Gloria C. Chiang
26,Nuclear Medicine,ProspectiveComparisonof68Ga-FAPIversus18F-FDGPET/CTforTumorStaginginBiliaryTractCancersnmgi,"Lianjun Lan, Shumao Zhang, Tingting Xu, Huipan Liu, Wei Wang, Yue Feng, Li Wang, Yue Chen, Lin Qiu"
27,Editorial,PETofFibroblast-ActivationProteinforCancerStaging:WhatWeKnowandWhatWeNeedtoLearnnmgi,Peter L. Choyke
28,Pediatric Imaging,ComparisonofQuantitativeLiverUSandMRIinPatientswithLiverDiseaseusgipdmr,"Vinicius P. V. Alves, Jonathan R. Dillman, Jean A. Tkach, Paula S. Bennett, Stavra A. Xanthakos, Andrew T. Trout"
29,Editorial,QuantitativeUSversusQuantitativeMRIintheAssessmentofPediatricChronicLiverDiseaseusgipdmr,"Geetika Khanna, Adina L. Alazraki"
30,Thoracic Imaging,EmphysemaProgressionatCTbyDeepLearningPredictsFunctionalImpairmentandMortality:ResultsfromtheCOPDGeneStudyctchai,"Andrea S. Oh, David Baraghoshi, David A. Lynch, Samuel Y. Ash, James D. Crapo, Stephen M. Humphries, for the COPDGene Investigators"
31,Editorial,DeepLearningAssessmentofEmphysemaProgressionatCTPredictsOutcomesctchai,Philippe A. Grenier
32,Thoracic Imaging,ArtificialIntelligenceToolforAssessmentofIndeterminatePulmonaryNodulesDetectedwithCTchai,"Roger Y. Kim, Jason L. Oke, Lyndsey C. Pickup, Reginald F. Munden, Travis L. Dotson, Christina R. Bellinger, Avi Cohen, Michael J. Simoff, Pierre P. Massion, Claire Filippini, Fergus V. Gleeson, Anil Vachani"
33,Editorial,ArtificialIntelligenceImprovesRadiologistPerformanceforPredictingMalignancyatChestCTchai,Masahiro Yanagawa
34,Thoracic Imaging,TractionBronchiectasis/BronchiolectasisonCTScansinRelationshiptoClinicalOutcomesandMortality:TheCOPDGeneStudyctch,"Akinori Hata, Takuya Hino, Rachel K. Putman, Masahiro Yanagawa, Tomoyuki Hida, Aravind A. Menon, Osamu Honda, Yoshitake Yamada, Mizuki Nishino, Tetsuro Araki, Vladimir I. Valtchinov, Masahiro Jinzaki, Hiroshi Honda, Kousei Ishigami, Takeshi Johkoh, Noriyuki Tomiyama, David C. Christiani, David A. Lynch, Raúl San José Estépar, George R. Washko, Michael H. Cho, Edwin K. Silverman, Gary M. Hunninghake, Hiroto Hatabu, for the COPDGene Investigators"
35,Editorial,TractionBronchiectasisandBronchiolectasisatCTPredictsSurvivalinIndividualswithInterstitialLungAbnormalities:TheCOPDGeneStudyctch,"Kyung Soo Lee, Yunjoo Im"
36,Vascular and Interventional Radiology,MicrowaveAblationversusSurgicalResectionforSolitaryT1N0M0PapillaryThyroidCarcinomahnir,"Ying Wei, Wen-quan Niu, Zhen-long Zhao, Jie Wu, Li-li Peng, Yan Li, Ming-an Yu"
37,Editorial,"MicrowaveAblationversusSurgeryforPapillaryThyroidCarcinoma:MoreTherapeuticOptions,MoreControversieshnir","Eric vanSonnenberg, Joseph F. Simeone"
38,Vascular and Interventional Radiology,ImpactofIntraproceduralSedationonAdrenalVeinSamplingwithoutCorticotropinStimulationvair,"Jun Yang, Renata Libianto, Kenneth K. Lau, James C. G. Doery, Ken L. Wan, Nicholas Y. N. Chee, Jimmy Shen, Peter J. Fuller, Winston Chong"
39,Editorial,ThereAreManyShortcutstoPerformingAdrenalVeinSampling:SedationTooComesataCostvair,Christos Georgiades
40,Vascular and Interventional Radiology,MRElastographyofAbdominalAorticAneurysms:RelationshiptoAneurysmEventsvamr,"Huiming Dong, Brian Raterman, Richard D. White, Jean Starr, Patrick Vaccaro, Mounir Haurani, Michael Go, Mariah Eisner, Guy Brock, Arunark Kolipaka"
41,Editorial,AbdominalAorticAneurysm:PredictionofRuptureRiskwithMRElastographyvamr,Hajime Sakuma
42,Case 309,Case309nr,"Paulo Puac-Polanco, Nader Zakhari, Gerard H. Jansen, Carlos Torres"
43,Case 305,Case305:LoefflerEndocarditisca,"Settimo Caruso, Gianluca Marrone, Giovanni Gentile"
44,Letters to the Editor,VaccinationandReducedSeverityofCOVID-19PneumoniaViewedatChestRadiography,"Andrea Borghesi, Roberto Maroldi"
45,Letters to the Editor,CardiacMRIandClinicalFollow-upinCOVID-19Vaccine–associatedMyocarditis,"Matteo Fronza, Paaladinesh Thavendiranathan, Gauri Rani Karur, Husam Abdel-Qadir, Jacob A. Udell, Rachel M. Wald, Kate Hanneman"
46,Letters to the Editor,LimitationsofaMultiparametricUSScoreforNASHPrediction,"Sergio Alfonso Valencia, Javier Andrés Romero"
47,Letters to the Editor,MRIversusCTinDetectingPulmonaryNodules,Arosh S. Perera Molligoda Arachchige
48,Letters to the Editor,FunctionalAnalysisoftheCentralRetinalArteryUsingMRIorUS,"Augustin Lecler, Loïc Duron"
49,Errata,QuantumIterativeReconstructionforAbdominalPhotoncountingDetectorCTImprovesImageQuality,"Thomas Sartoretti, Anna Landsmann, Dominik Nakhostin, Matthias Eberhard, Christian Roeren, Victor Mergen, Kai Higashigaito, Rainer Raupach, Hatem Alkadhi, André Euler"
50,Errata,ValidationofArtificialIntelligenceCardiacMRIMeasurements:RelationshiptoHeartCatheterizationandMortalityPrediction,"Samer Alabed, Faisal Alandejani, Krit Dwivedi, Kavita Karunasaagarar, Michael Sharkey, Pankaj Garg, Patrick J. H. de Koning, Attila Tóth, Yousef Shahin, Christopher Johns, Michail Mamalakis, Sarah Stott, David Capener, Steven Wood, Peter Metherall, Alexander M. K. Rothman, Robin Condliffe, Neil Hamilton, James M. Wild, Declan P. O'Regan, Haiping Lu, David G. Kiely, Rob J. van der Geest, Andrew J. Swift"
51,Errata,AxillaryAdenopathyafterCOVID-19Vaccine:NoReasontoDelayScreeningMammogram,"Stacey Wolfson, Eric Kim, Anastasia Plaunova, Rita Bukhman, Ruth D. Sarmiento, Naziya Samreen, Divya Awal, Monica M. Sheth, Hildegard B. Toth, Linda Moy, Beatriu Reig"
